{
  "protocolId": "ascii-art-powershell-cli-v1",
  "runId": "P07-R1-control-A1",
  "scheduleId": "P07-R1-control",
  "promptId": "P07",
  "status": "pass",
  "unavailableReason": null,
  "functional": {
    "status": "pass",
    "unavailableReason": null,
    "assertions": [
      {
        "id": "tags-normalize",
        "status": "pass",
        "message": "Add normalizes, sorts, and de-duplicates tags."
      },
      {
        "id": "tags-change",
        "status": "pass",
        "message": "Tag command updates a legacy task."
      },
      {
        "id": "tags-banner",
        "status": "pass",
        "message": "Text tag changes render the exact registered banner once before the expected result."
      },
      {
        "id": "tags-and-filter",
        "status": "pass",
        "message": "List tag filtering uses AND semantics."
      },
      {
        "id": "tags-invalid",
        "status": "pass",
        "message": "Invalid tag leaves storage unchanged."
      }
    ]
  },
  "art": {
    "status": "pass",
    "unavailableReason": null,
    "assertions": [
      {
        "id": "art-constraints",
        "status": "pass",
        "message": "All deterministic art constraints passed."
      }
    ]
  },
  "tamperCheck": {
    "status": "pass",
    "unavailableReason": null,
    "assertions": [
      {
        "id": "initial-fixture-lock",
        "status": "pass",
        "message": "Initial candidate commit matches the registered fixture lock."
      },
      {
        "id": "terminal-fixture-lock-provenance",
        "status": "pass",
        "message": "Terminal candidate commit preserves the initial fixture lock."
      },
      {
        "id": "acceptance-contamination",
        "status": "pass",
        "message": "No external acceptance or benchmark control files are present in the candidate commit."
      },
      {
        "id": "terminal-commit-materialized",
        "status": "pass",
        "message": "Candidate was materialized from exact terminal commit ab60f21ce5afb092632ac3b7c70c8dd08a954d55."
      },
      {
        "id": "evaluated-bundle-byte-identity",
        "status": "pass",
        "message": "Every evaluated source, fixture test, and banner byte matched the terminal Git blob bytes used by the artifact bundle."
      }
    ]
  },
  "startedAt": "2026-07-29T15:38:07.790Z",
  "completedAt": "2026-07-29T15:38:17.072Z"
}
