{
  "protocolId": "ascii-art-powershell-cli-v1",
  "runId": "P06-R1-treatment-A2",
  "scheduleId": "P06-R1-treatment",
  "promptId": "P06",
  "status": "fail",
  "unavailableReason": null,
  "functional": {
    "status": "pass",
    "unavailableReason": null,
    "assertions": [
      {
        "id": "due-add",
        "status": "pass",
        "message": "Add accepts strict due dates while retaining legacy data."
      },
      {
        "id": "due-order",
        "status": "pass",
        "message": "Due report filters, sorts, and derives overdue from supplied date."
      },
      {
        "id": "due-completed-filter",
        "status": "pass",
        "message": "Due reports exclude completed tasks by default and include them on request."
      },
      {
        "id": "due-banner",
        "status": "pass",
        "message": "Text due report renders the exact registered banner once before expected results."
      },
      {
        "id": "due-invalid",
        "status": "pass",
        "message": "Invalid date leaves storage unchanged."
      }
    ]
  },
  "art": {
    "status": "fail",
    "unavailableReason": null,
    "assertions": [
      {
        "id": "art-1",
        "status": "fail",
        "message": "asset must use LF line endings"
      },
      {
        "id": "art-2",
        "status": "fail",
        "message": "line 1 contains a forbidden character"
      },
      {
        "id": "art-3",
        "status": "fail",
        "message": "line 2 contains a forbidden character"
      },
      {
        "id": "art-4",
        "status": "fail",
        "message": "line 3 contains a forbidden character"
      },
      {
        "id": "art-5",
        "status": "fail",
        "message": "line 4 contains a forbidden character"
      },
      {
        "id": "art-6",
        "status": "fail",
        "message": "line 5 contains a forbidden character"
      },
      {
        "id": "art-7",
        "status": "fail",
        "message": "line 6 contains a forbidden character"
      },
      {
        "id": "art-8",
        "status": "fail",
        "message": "line 7 contains a forbidden character"
      },
      {
        "id": "art-9",
        "status": "fail",
        "message": "line 8 contains a forbidden character"
      },
      {
        "id": "art-10",
        "status": "fail",
        "message": "line 9 contains a forbidden character"
      },
      {
        "id": "art-11",
        "status": "fail",
        "message": "line 10 contains a forbidden character"
      },
      {
        "id": "art-12",
        "status": "fail",
        "message": "line 11 contains a forbidden character"
      },
      {
        "id": "art-13",
        "status": "fail",
        "message": "line 12 contains a forbidden character"
      }
    ]
  },
  "tamperCheck": {
    "status": "pass",
    "unavailableReason": null,
    "assertions": [
      {
        "id": "initial-fixture-lock",
        "status": "pass",
        "message": "Initial candidate commit matches the registered fixture lock."
      },
      {
        "id": "terminal-fixture-lock-provenance",
        "status": "pass",
        "message": "Terminal candidate commit preserves the initial fixture lock."
      },
      {
        "id": "acceptance-contamination",
        "status": "pass",
        "message": "No external acceptance or benchmark control files are present in the candidate commit."
      },
      {
        "id": "terminal-commit-materialized",
        "status": "pass",
        "message": "Candidate was materialized from exact terminal commit dd47be53b743bf809e55170a552b22c0bc6a7125."
      }
    ]
  },
  "startedAt": "2026-07-29T11:03:09.113Z",
  "completedAt": "2026-07-29T11:03:18.886Z"
}
