{
  "protocolId": "ascii-art-powershell-cli-v1",
  "runId": "P09-R2-treatment-A1",
  "scheduleId": "P09-R2-treatment",
  "promptId": "P09",
  "status": "unavailable",
  "unavailableReason": "parent_cli_session_not_started_telemetry_unavailable",
  "functional": {
    "status": "unavailable",
    "unavailableReason": "parent_cli_session_not_started_telemetry_unavailable",
    "assertions": [
      {
        "id": "functional-unavailable",
        "status": "unavailable",
        "message": "The parent project session was created, but no CLI session or task execution evidence was recorded."
      }
    ]
  },
  "art": {
    "status": "unavailable",
    "unavailableReason": "parent_cli_session_not_started_telemetry_unavailable",
    "assertions": [
      {
        "id": "art-unavailable",
        "status": "unavailable",
        "message": "The parent project session was created, but no CLI session or task execution evidence was recorded."
      }
    ]
  },
  "tamperCheck": {
    "status": "unavailable",
    "unavailableReason": "parent_cli_session_not_started_telemetry_unavailable",
    "assertions": [
      {
        "id": "tamper-unavailable",
        "status": "unavailable",
        "message": "The parent project session was created, but no CLI session or task execution evidence was recorded."
      }
    ]
  },
  "startedAt": "2026-07-29T08:33:21.153Z",
  "completedAt": "2026-07-29T08:33:21.153Z"
}
