{
  "protocolId": "ascii-art-powershell-cli-v1",
  "runId": "P04-R2-control-A1",
  "scheduleId": "P04-R2-control",
  "promptId": "P04",
  "status": "pass",
  "unavailableReason": null,
  "functional": {
    "status": "pass",
    "unavailableReason": null,
    "assertions": [
      {
        "id": "config-set",
        "status": "pass",
        "message": "Supported configuration keys can be set."
      },
      {
        "id": "config-defaults",
        "status": "pass",
        "message": "Relative dataFile and defaultJson are applied."
      },
      {
        "id": "config-list-json",
        "status": "pass",
        "message": "JSON config list is valid and banner-free."
      },
      {
        "id": "config-get",
        "status": "pass",
        "message": "Config get returns a stored value."
      },
      {
        "id": "config-override",
        "status": "pass",
        "message": "Explicit data-file overrides configured dataFile."
      },
      {
        "id": "config-banner",
        "status": "pass",
        "message": "Text config list renders the exact registered banner once before expected settings."
      },
      {
        "id": "config-invalid-atomic",
        "status": "pass",
        "message": "Unknown key leaves config unchanged."
      }
    ]
  },
  "art": {
    "status": "pass",
    "unavailableReason": null,
    "assertions": [
      {
        "id": "art-constraints",
        "status": "pass",
        "message": "All deterministic art constraints passed."
      }
    ]
  },
  "tamperCheck": {
    "status": "pass",
    "unavailableReason": null,
    "assertions": [
      {
        "id": "initial-fixture-lock",
        "status": "pass",
        "message": "Initial candidate commit matches the registered fixture lock."
      },
      {
        "id": "terminal-fixture-lock-provenance",
        "status": "pass",
        "message": "Terminal candidate commit preserves the initial fixture lock."
      },
      {
        "id": "acceptance-contamination",
        "status": "pass",
        "message": "No external acceptance or benchmark control files are present in the candidate commit."
      },
      {
        "id": "terminal-commit-materialized",
        "status": "pass",
        "message": "Candidate was materialized from exact terminal commit 87a691d91ea3e1dee2b5969809b2b58d07528289."
      },
      {
        "id": "evaluated-bundle-byte-identity",
        "status": "pass",
        "message": "Every evaluated source, fixture test, and banner byte matched the terminal Git blob bytes used by the artifact bundle."
      }
    ]
  },
  "startedAt": "2026-07-29T15:51:53.502Z",
  "completedAt": "2026-07-29T15:52:06.578Z"
}
