{
  "protocolId": "ascii-art-powershell-cli-v1",
  "runId": "P01-R1-control-A1",
  "scheduleId": "P01-R1-control",
  "promptId": "P01",
  "status": "pass",
  "unavailableReason": null,
  "functional": {
    "status": "pass",
    "unavailableReason": null,
    "assertions": [
      {
        "id": "search-json",
        "status": "pass",
        "message": "JSON search finds title and description matches case-insensitively."
      },
      {
        "id": "search-json-clean",
        "status": "pass",
        "message": "JSON search output is banner-free."
      },
      {
        "id": "search-status",
        "status": "pass",
        "message": "Status filter narrows matches."
      },
      {
        "id": "search-empty",
        "status": "pass",
        "message": "Text search has stable empty output."
      },
      {
        "id": "search-banner",
        "status": "pass",
        "message": "Text search renders the exact registered banner once before its expected result."
      }
    ]
  },
  "art": {
    "status": "pass",
    "unavailableReason": null,
    "assertions": [
      {
        "id": "art-constraints",
        "status": "pass",
        "message": "All deterministic art constraints passed."
      }
    ]
  },
  "tamperCheck": {
    "status": "pass",
    "unavailableReason": null,
    "assertions": [
      {
        "id": "initial-fixture-lock",
        "status": "pass",
        "message": "Initial candidate commit matches the registered fixture lock."
      },
      {
        "id": "terminal-fixture-lock-provenance",
        "status": "pass",
        "message": "Terminal candidate commit changed fixture-owned files and its lock; external acceptance remained isolated."
      },
      {
        "id": "acceptance-contamination",
        "status": "pass",
        "message": "No external acceptance or benchmark control files are present in the candidate commit."
      },
      {
        "id": "terminal-commit-materialized",
        "status": "pass",
        "message": "Candidate was materialized from exact terminal commit 8a534bfd479ef1dd4cbc76b675b5d6ee5560d109."
      },
      {
        "id": "evaluated-bundle-byte-identity",
        "status": "pass",
        "message": "Every evaluated source, fixture test, and banner byte matched the terminal Git blob bytes used by the artifact bundle."
      }
    ]
  },
  "startedAt": "2026-07-29T15:42:18.438Z",
  "completedAt": "2026-07-29T15:42:24.459Z"
}
