{
  "protocolId": "ascii-art-powershell-cli-v1",
  "runId": "P07-R3-control-A1",
  "scheduleId": "P07-R3-control",
  "promptId": "P07",
  "status": "fail",
  "unavailableReason": null,
  "functional": {
    "status": "pass",
    "unavailableReason": null,
    "assertions": [
      {
        "id": "tags-normalize",
        "status": "pass",
        "message": "Add normalizes, sorts, and de-duplicates tags."
      },
      {
        "id": "tags-change",
        "status": "pass",
        "message": "Tag command updates a legacy task."
      },
      {
        "id": "tags-banner",
        "status": "pass",
        "message": "Text tag changes render the exact registered banner once before the expected result."
      },
      {
        "id": "tags-and-filter",
        "status": "pass",
        "message": "List tag filtering uses AND semantics."
      },
      {
        "id": "tags-invalid",
        "status": "pass",
        "message": "Invalid tag leaves storage unchanged."
      }
    ]
  },
  "art": {
    "status": "fail",
    "unavailableReason": null,
    "assertions": [
      {
        "id": "art-1",
        "status": "fail",
        "message": "asset must use LF line endings"
      },
      {
        "id": "art-2",
        "status": "fail",
        "message": "line 1 contains a forbidden character"
      },
      {
        "id": "art-3",
        "status": "fail",
        "message": "line 2 contains a forbidden character"
      },
      {
        "id": "art-4",
        "status": "fail",
        "message": "line 3 contains a forbidden character"
      },
      {
        "id": "art-5",
        "status": "fail",
        "message": "line 4 contains a forbidden character"
      },
      {
        "id": "art-6",
        "status": "fail",
        "message": "line 5 contains a forbidden character"
      },
      {
        "id": "art-7",
        "status": "fail",
        "message": "line 6 contains a forbidden character"
      },
      {
        "id": "art-8",
        "status": "fail",
        "message": "line 7 contains a forbidden character"
      },
      {
        "id": "art-9",
        "status": "fail",
        "message": "line 8 contains a forbidden character"
      },
      {
        "id": "art-10",
        "status": "fail",
        "message": "line 9 contains a forbidden character"
      },
      {
        "id": "art-11",
        "status": "fail",
        "message": "line 10 contains a forbidden character"
      },
      {
        "id": "art-12",
        "status": "fail",
        "message": "line 11 contains a forbidden character"
      },
      {
        "id": "art-13",
        "status": "fail",
        "message": "line 12 contains a forbidden character"
      }
    ]
  },
  "tamperCheck": {
    "status": "pass",
    "unavailableReason": null,
    "assertions": [
      {
        "id": "initial-fixture-lock",
        "status": "pass",
        "message": "Initial candidate commit matches the registered fixture lock."
      },
      {
        "id": "terminal-fixture-lock-provenance",
        "status": "pass",
        "message": "Terminal candidate commit preserves the initial fixture lock."
      },
      {
        "id": "acceptance-contamination",
        "status": "pass",
        "message": "No external acceptance or benchmark control files are present in the candidate commit."
      },
      {
        "id": "terminal-commit-materialized",
        "status": "pass",
        "message": "Candidate was materialized from exact terminal commit ab45f70df4947bdb84bc66f8d0778d0e11fe2d2c."
      }
    ]
  },
  "startedAt": "2026-07-29T11:09:37.520Z",
  "completedAt": "2026-07-29T11:09:45.190Z"
}
