{
  "protocolId": "ascii-art-powershell-cli-v1",
  "runId": "P03-R2-treatment-A1",
  "scheduleId": "P03-R2-treatment",
  "promptId": "P03",
  "status": "fail",
  "unavailableReason": null,
  "functional": {
    "status": "pass",
    "unavailableReason": null,
    "assertions": [
      {
        "id": "export-filtered",
        "status": "pass",
        "message": "Filtered export writes the expected tasks and count."
      },
      {
        "id": "export-order",
        "status": "pass",
        "message": "Export is ordered by numeric ID."
      },
      {
        "id": "export-banner",
        "status": "pass",
        "message": "Text export renders the exact registered banner once before its expected summary."
      },
      {
        "id": "export-invalid-atomic",
        "status": "pass",
        "message": "Invalid status does not replace destination."
      }
    ]
  },
  "art": {
    "status": "fail",
    "unavailableReason": null,
    "assertions": [
      {
        "id": "art-1",
        "status": "fail",
        "message": "asset must use LF line endings"
      },
      {
        "id": "art-2",
        "status": "fail",
        "message": "line 1 contains a forbidden character"
      },
      {
        "id": "art-3",
        "status": "fail",
        "message": "line 2 contains a forbidden character"
      },
      {
        "id": "art-4",
        "status": "fail",
        "message": "line 3 contains a forbidden character"
      },
      {
        "id": "art-5",
        "status": "fail",
        "message": "line 4 contains a forbidden character"
      },
      {
        "id": "art-6",
        "status": "fail",
        "message": "line 5 contains a forbidden character"
      },
      {
        "id": "art-7",
        "status": "fail",
        "message": "line 6 contains a forbidden character"
      },
      {
        "id": "art-8",
        "status": "fail",
        "message": "line 7 contains a forbidden character"
      },
      {
        "id": "art-9",
        "status": "fail",
        "message": "line 8 contains a forbidden character"
      },
      {
        "id": "art-10",
        "status": "fail",
        "message": "line 9 contains a forbidden character"
      },
      {
        "id": "art-11",
        "status": "fail",
        "message": "line 10 contains a forbidden character"
      },
      {
        "id": "art-12",
        "status": "fail",
        "message": "line 11 contains a forbidden character"
      },
      {
        "id": "art-13",
        "status": "fail",
        "message": "line 12 contains a forbidden character"
      }
    ]
  },
  "tamperCheck": {
    "status": "pass",
    "unavailableReason": null,
    "assertions": [
      {
        "id": "initial-fixture-lock",
        "status": "pass",
        "message": "Initial candidate commit matches the registered fixture lock."
      },
      {
        "id": "terminal-fixture-lock-provenance",
        "status": "pass",
        "message": "Terminal candidate commit preserves the initial fixture lock."
      },
      {
        "id": "acceptance-contamination",
        "status": "pass",
        "message": "No external acceptance or benchmark control files are present in the candidate commit."
      },
      {
        "id": "terminal-commit-materialized",
        "status": "pass",
        "message": "Candidate was materialized from exact terminal commit 2d3c6aee21b69949dee225d2b3cea321a4d0685d."
      }
    ]
  },
  "startedAt": "2026-07-29T11:08:06.429Z",
  "completedAt": "2026-07-29T11:08:11.550Z"
}
