{
  "protocolId": "ascii-art-powershell-cli-v1",
  "runId": "P09-R2-control-A1",
  "scheduleId": "P09-R2-control",
  "promptId": "P09",
  "status": "fail",
  "unavailableReason": null,
  "functional": {
    "status": "fail",
    "unavailableReason": null,
    "assertions": [
      {
        "id": "undo-add",
        "status": "fail",
        "message": "Undo restores exact pre-add storage across processes."
      },
      {
        "id": "undo-consumed",
        "status": "pass",
        "message": "Successful undo consumes the record."
      },
      {
        "id": "undo-failed-preserves",
        "status": "pass",
        "message": "Failed mutation does not replace a valid undo record."
      },
      {
        "id": "undo-remove",
        "status": "pass",
        "message": "Undo restores a removed task."
      },
      {
        "id": "undo-banner",
        "status": "pass",
        "message": "Text undo renders the exact registered banner once before its expected result."
      }
    ]
  },
  "art": {
    "status": "pass",
    "unavailableReason": null,
    "assertions": [
      {
        "id": "art-constraints",
        "status": "pass",
        "message": "All deterministic art constraints passed."
      }
    ]
  },
  "tamperCheck": {
    "status": "pass",
    "unavailableReason": null,
    "assertions": [
      {
        "id": "initial-fixture-lock",
        "status": "pass",
        "message": "Initial candidate commit matches the registered fixture lock."
      },
      {
        "id": "terminal-fixture-lock-provenance",
        "status": "pass",
        "message": "Terminal candidate commit preserves the initial fixture lock."
      },
      {
        "id": "acceptance-contamination",
        "status": "pass",
        "message": "No external acceptance or benchmark control files are present in the candidate commit."
      },
      {
        "id": "terminal-commit-materialized",
        "status": "pass",
        "message": "Candidate was materialized from exact terminal commit 0862eb77f8b172cf6d17b3f84aa6e1fb4706f307."
      },
      {
        "id": "evaluated-bundle-byte-identity",
        "status": "pass",
        "message": "Every evaluated source, fixture test, and banner byte matched the terminal Git blob bytes used by the artifact bundle."
      }
    ]
  },
  "startedAt": "2026-07-29T15:48:41.503Z",
  "completedAt": "2026-07-29T15:48:53.977Z"
}
